{
  "$schema": "https://json-schema.org/draft/2020-12/schema",
  "$id": "https://mylittlegamestudio.local/schemas/art-review.schema.json",
  "title": "MLGS fail-closed art review",
  "type": "object",
  "additionalProperties": false,
  "required": ["schemaVersion", "assetId", "visualTargetIds", "targetImages", "candidateSource", "processedAsset", "unityReferences", "inGameScreenshots", "scores", "automatedVerdict", "artDirectorVerdict", "qaVerdict", "finalVerdict", "attempt", "maxAttempts", "blockers", "notes", "updated"],
  "properties": {
    "$schema": { "type": "string" },
    "schemaVersion": { "const": "1.0" },
    "assetId": { "type": "string", "minLength": 1 },
    "visualTargetIds": { "type": "array", "minItems": 1, "items": { "type": "string", "minLength": 1 }, "uniqueItems": true },
    "targetImages": { "type": "array", "minItems": 1, "items": { "type": "string", "minLength": 1 }, "uniqueItems": true },
    "candidateSource": { "type": "string", "minLength": 1 },
    "processedAsset": { "type": "string", "minLength": 1 },
    "unityReferences": { "type": "array", "minItems": 1, "items": { "type": "string", "minLength": 1 }, "uniqueItems": true },
    "inGameScreenshots": { "type": "array", "minItems": 1, "items": { "type": "string", "minLength": 1 }, "uniqueItems": true },
    "scores": {
      "type": "object",
      "additionalProperties": false,
      "required": ["targetMatch", "composition", "palette", "value", "material", "detail", "readability"],
      "properties": {
        "targetMatch": { "type": "integer", "minimum": 0, "maximum": 100 },
        "composition": { "type": "integer", "minimum": 0, "maximum": 100 },
        "palette": { "type": "integer", "minimum": 0, "maximum": 100 },
        "value": { "type": "integer", "minimum": 0, "maximum": 100 },
        "material": { "type": "integer", "minimum": 0, "maximum": 100 },
        "detail": { "type": "integer", "minimum": 0, "maximum": 100 },
        "readability": { "type": "integer", "minimum": 0, "maximum": 100 }
      }
    },
    "automatedVerdict": { "enum": ["pending", "pass", "fail", "unavailable", "error"] },
    "artDirectorVerdict": { "enum": ["pending", "pass", "fail", "blocked"] },
    "qaVerdict": { "enum": ["pending", "pass", "fail", "blocked"] },
    "finalVerdict": { "enum": ["pending", "pass", "fail", "blocked"] },
    "attempt": { "type": "integer", "minimum": 1, "maximum": 5 },
    "maxAttempts": { "type": "integer", "minimum": 1, "maximum": 5 },
    "blockers": { "type": "array", "items": { "type": "string", "minLength": 1 }, "uniqueItems": true },
    "notes": { "type": "string" },
    "updated": { "type": "string", "minLength": 1 }
  }
}
